{
  "$schema": "https://json-schema.org/draft/2020-12/schema",
  "$id": "divoom://astrotoo/watchface/schema",
  "title": "AstroToo 480x480 watchface",
  "type": "object",
  "additionalProperties": true,
  "required": [
    "ItemList"
  ],
  "properties": {
    "ClockId": {
      "type": "integer",
      "description": "0 for new/local drafts; positive when synced from device template."
    },
    "NameCn": {
      "type": "string"
    },
    "NameEn": {
      "type": "string"
    },
    "ItemIdList": {
      "type": "array",
      "items": {
        "type": "string"
      },
      "description": "Parallel ids for ItemList order; editor can regenerate from item_id."
    },
    "ItemList": {
      "type": "array",
      "items": {
        "$ref": "#/$defs/item"
      }
    }
  },
  "$defs": {
    "item": {
      "type": "object",
      "additionalProperties": true,
      "required": [
        "disp"
      ],
      "properties": {
        "item_id": {
          "type": "string",
          "description": "Stable string key for the item."
        },
        "disp": {
          "type": "integer",
          "enum": [
            1,
            2,
            3,
            4,
            5,
            6,
            7,
            8,
            9,
            10,
            11,
            12,
            13,
            14,
            15,
            16,
            17,
            18,
            19,
            20,
            21,
            22,
            23,
            24,
            25,
            26,
            27,
            28,
            29,
            30,
            31,
            32,
            33,
            34,
            35,
            36,
            37,
            38,
            39,
            40,
            41,
            42,
            43,
            45,
            46,
            47,
            48,
            49,
            50,
            51,
            52,
            53,
            54,
            55,
            56,
            57,
            58,
            59,
            60,
            61,
            62,
            63,
            64,
            66,
            67,
            68,
            69,
            70,
            71,
            72,
            73,
            74,
            75,
            76,
            77,
            78,
            79,
            80,
            81,
            82,
            83,
            84,
            85,
            86,
            87,
            88,
            89,
            90,
            91,
            92,
            93,
            94,
            95,
            96,
            97,
            98,
            99,
            100,
            101,
            102,
            103,
            104,
            105,
            106,
            107,
            108,
            109,
            110,
            111,
            112,
            113,
            114,
            115,
            116,
            117,
            118,
            119,
            120,
            121,
            122,
            123,
            124,
            125,
            126,
            127,
            128,
            129,
            130,
            131,
            132,
            133,
            134,
            135,
            136,
            137,
            138,
            139,
            140,
            141,
            142,
            143,
            144,
            145,
            146,
            147,
            148,
            149,
            150,
            151,
            152,
            153,
            156,
            157,
            158,
            159,
            166,
            169,
            170,
            171,
            172,
            173,
            174,
            175,
            176,
            177,
            178,
            179,
            180,
            182,
            185,
            186,
            187,
            188,
            189,
            190,
            191,
            193,
            194,
            195,
            196,
            198,
            199,
            200,
            201,
            202,
            203,
            204,
            205,
            206,
            207,
            208,
            209,
            210,
            211,
            212,
            215,
            216,
            217,
            218,
            219,
            220,
            221,
            222,
            223,
            224,
            225,
            226,
            227,
            228,
            229,
            230,
            231,
            232,
            233,
            234,
            235,
            236,
            237,
            238,
            239,
            240,
            241,
            242,
            243,
            244,
            245,
            246,
            247,
            248,
            249,
            250,
            251,
            252,
            253,
            254,
            255,
            256,
            257,
            258,
            259,
            260,
            261,
            262,
            263,
            264,
            265,
            266,
            267,
            268,
            269,
            270,
            271,
            272,
            273,
            274,
            275,
            276,
            277,
            278,
            279,
            281,
            282,
            283,
            284,
            291,
            292,
            293,
            294,
            295,
            296,
            297,
            298,
            303,
            304,
            305,
            306,
            307,
            308,
            309,
            310,
            311,
            312,
            313,
            314,
            315,
            316,
            317,
            318,
            319,
            320,
            321,
            322,
            323,
            324,
            325,
            326,
            327,
            328,
            329,
            330,
            331,
            332,
            333,
            334,
            335,
            336,
            337,
            338,
            339,
            340,
            341,
            342,
            343,
            344,
            345,
            346,
            347,
            348,
            349,
            350,
            351,
            352,
            354,
            355,
            356,
            357,
            358,
            359,
            360,
            361,
            362,
            363,
            364,
            365,
            366,
            367,
            368,
            369,
            370,
            371,
            372,
            373,
            374,
            375,
            376,
            377,
            378,
            379,
            380,
            381,
            382,
            383,
            384,
            385,
            386,
            387,
            388,
            389,
            390,
            391,
            392,
            394,
            395,
            396,
            397,
            398,
            399,
            400,
            401,
            402,
            403,
            404,
            405,
            406,
            407,
            408,
            409,
            410,
            411,
            412,
            413,
            414,
            415,
            416,
            417,
            418,
            419,
            420,
            421,
            423,
            426,
            427,
            428,
            429,
            430,
            431,
            432,
            433,
            434,
            435,
            436,
            437,
            438,
            439,
            440,
            441,
            442,
            443,
            444,
            445,
            446,
            447,
            448,
            449,
            450,
            451,
            452,
            453,
            454,
            455,
            456,
            458,
            459,
            460,
            461,
            462,
            463,
            464,
            465,
            466,
            467,
            468,
            469,
            470,
            471,
            472,
            473,
            474,
            475,
            476,
            477,
            478,
            479,
            480,
            481,
            482,
            483,
            484,
            485,
            486,
            487,
            488,
            489,
            490,
            491,
            492,
            495,
            496,
            497,
            498,
            499,
            500,
            501,
            502,
            503,
            504,
            505,
            506,
            507,
            508,
            510,
            511,
            512,
            513,
            514,
            515,
            516,
            518,
            519,
            520,
            521,
            522,
            523,
            524,
            525,
            526,
            527,
            528,
            529,
            530,
            531,
            532,
            533,
            534,
            535,
            536,
            537,
            538
          ]
        },
        "font": {
          "type": "integer",
          "description": "Font id from FontList in font_info.cfg / docs/generated/ai-font-catalog.json"
        },
        "size": {
          "type": "number"
        },
        "x": {
          "type": "integer",
          "minimum": 0,
          "maximum": 479
        },
        "y": {
          "type": "integer",
          "minimum": 0,
          "maximum": 479
        },
        "w": {
          "type": "integer",
          "minimum": 0,
          "maximum": 480
        },
        "h": {
          "type": "integer",
          "minimum": 0,
          "maximum": 480
        },
        "alig": {
          "type": "integer",
          "description": "Alignment code used by editor (e.g. 1 left, 3 center — align with firmware docs)."
        },
        "sep": {
          "type": "number",
          "description": "Character spacing where applicable."
        },
        "angle": {
          "type": "number"
        },
        "hier": {
          "type": "integer",
          "enum": [
            0,
            1,
            2
          ]
        },
        "transp": {
          "type": "number",
          "minimum": 0,
          "maximum": 100
        },
        "animation": {
          "type": "number"
        },
        "image_id": {
          "type": "number"
        },
        "image_addr": {
          "type": "string"
        },
        "color_1": {
          "type": "string",
          "pattern": "^#[0-9A-Fa-f]{6}$"
        },
        "color_2": {
          "type": "string",
          "pattern": "^#[0-9A-Fa-f]{6}$"
        }
      }
    }
  }
}
